{
  "$schema": "../../../schemas/plugin-manifest.schema.json",
  "id": "org.wyrmgrid.example.idle-aircraft",
  "name": "Idle Aircraft Example",
  "version": "0.1.0",
  "api_version": 1,
  "author": "WyrmGrid contributors",
  "entry_point": "src/main.py",
  "permissions": ["on_air_fleet_read", "map_layers_publish", "plugin_storage"]
}
